{
  "schema_version": "1.0.0",
  "pipeline_execution_id": "TSM-EXAMPLE-NOT-A-RUN",
  "aoi_target_id": "AOI-UNRESOLVED-EXAMPLE",
  "created_at_utc": "2026-10-15T12:30:00Z",
  "execution_policy": {
    "resilient": true,
    "human_approval_required": true,
    "allow_solver_execution": false
  },
  "gates": {
    "terrain": {
      "status": "BLOCKED_MISSING_INPUT",
      "evaluated_at_utc": "2026-10-15T12:30:00Z",
      "execution_blocked": true,
      "evidence": [],
      "issues": [
        "No DEM artifact attached; terrain QA has not run."
      ]
    },
    "jurisdiction_sources": {
      "status": "FETCHED_UNVALIDATED",
      "evaluated_at_utc": "2026-10-15T12:30:00Z",
      "execution_blocked": true,
      "evidence": [],
      "issues": [
        "Illustrative template only; no jurisdiction source adapters were executed."
      ]
    },
    "outlet": {
      "status": "BLOCKED_MISSING_INPUT",
      "evaluated_at_utc": "2026-10-15T12:30:00Z",
      "execution_blocked": true,
      "evidence": [],
      "issues": [
        "No verified outlet evidence attached."
      ]
    },
    "catchment": {
      "status": "BLOCKED_NOT_RUN",
      "evaluated_at_utc": "2026-10-15T12:30:00Z",
      "execution_blocked": true,
      "evidence": [],
      "issues": [
        "Catchment delineation requires validated terrain and reviewed outlet."
      ]
    },
    "model": {
      "status": "BLOCKED_NOT_RUN",
      "execution_blocked": true,
      "dependencies": [
        "terrain",
        "jurisdiction_sources",
        "outlet",
        "catchment"
      ],
      "human_approval": {
        "approved": false,
        "reviewer_id": null,
        "approved_at_utc": null,
        "scope": null
      },
      "solver_artifacts": [],
      "issues": [
        "Template has no validated inputs or human authorization; do not execute HEC-HMS/HEC-RAS."
      ]
    }
  }
}
